<?xml version="1.0" encoding="UTF-8"?><p:participants xmlns:p="http://webservice.caaers.cabig.nci.nih.gov/participant" xmlns:xsi="http://www.w3.org/2001/XMLSchema-instance" xsi:schemaLocation="http://webservice.caaers.cabig.nci.nih.gov/participant ParticipantSchema.xsd"><p:participant><firstName>Richard-0</firstName><lastName>Herd-0</lastName><maidenName></maidenName><middleName></middleName><birthDate>2001-01-01</birthDate><gender>Unknown</gender><race>Unknown</race><ethnicity>Unknown</ethnicity><identifiers><p:organizationAssignedIdentifier><type>MRN</type><value>barboza0</value><primaryIndicator>true</primaryIndicator><p:organization><name>Mayo Clinic Hospital</name></p:organization></p:organizationAssignedIdentifier><p:systemAssignedIdentifier><type>MRN</type><value>barboza0</value><primaryIndicator>true</primaryIndicator><systemName>Yarois</systemName></p:systemAssignedIdentifier></identifiers><assignments><p:assignment><p:studySite><p:study><identifiers><identifier><type>Protocol Authority Identifier</type><value>N027D</value></identifier></identifiers></p:study><p:organization><name>Cancer Therapy Evaluation Program</name></p:organization></p:studySite></p:assignment></assignments></p:participant>
<p:participant><firstName>Richard-1</firstName><lastName>Herd-1</lastName><maidenName></maidenName><middleName></middleName><birthDate>2001-01-01</birthDate><gender>Unknown</gender><race>Unknown</race><ethnicity>Unknown</ethnicity><identifiers><p:organizationAssignedIdentifier><type>MRN</type><value>barboza1</value><primaryIndicator>true</primaryIndicator><p:organization><name>Mayo Clinic Hospital</name></p:organization></p:organizationAssignedIdentifier><p:systemAssignedIdentifier><type>MRN</type><value>barboza1</value><primaryIndicator>true</primaryIndicator><systemName>Yarois</systemName></p:systemAssignedIdentifier></identifiers><assignments><p:assignment><p:studySite><p:study><identifiers><identifier><type>Protocol Authority Identifier</type><value>N027D</value></identifier></identifiers></p:study><p:organization><name>Cancer Therapy Evaluation Program</name></p:organization></p:studySite></p:assignment></assignments></p:participant>
<p:participant><firstName>Richard-2</firstName><lastName>Herd-2</lastName><maidenName></maidenName><middleName></middleName><birthDate>2001-01-01</birthDate><gender>Unknown</gender><race>Unknown</race><ethnicity>Unknown</ethnicity><identifiers><p:organizationAssignedIdentifier><type>MRN</type><value>barboza2</value><primaryIndicator>true</primaryIndicator><p:organization><name>Mayo Clinic Hospital</name></p:organization></p:organizationAssignedIdentifier><p:systemAssignedIdentifier><type>MRN</type><value>barboza2</value><primaryIndicator>true</primaryIndicator><systemName>Yarois</systemName></p:systemAssignedIdentifier></identifiers><assignments><p:assignment><p:studySite><p:study><identifiers><identifier><type>Protocol Authority Identifier</type><value>N027D</value></identifier></identifiers></p:study><p:organization><name>Cancer Therapy Evaluation Program</name></p:organization></p:studySite></p:assignment></assignments></p:participant>
<p:participant><firstName>Richard-3</firstName><lastName>Herd-3</lastName><maidenName></maidenName><middleName></middleName><birthDate>2001-01-01</birthDate><gender>Unknown</gender><race>Unknown</race><ethnicity>Unknown</ethnicity><identifiers><p:organizationAssignedIdentifier><type>MRN</type><value>barboza3</value><primaryIndicator>true</primaryIndicator><p:organization><name>Mayo Clinic Hospital</name></p:organization></p:organizationAssignedIdentifier><p:systemAssignedIdentifier><type>MRN</type><value>barboza3</value><primaryIndicator>true</primaryIndicator><systemName>Yarois</systemName></p:systemAssignedIdentifier></identifiers><assignments><p:assignment><p:studySite><p:study><identifiers><identifier><type>Protocol Authority Identifier</type><value>N027D</value></identifier></identifiers></p:study><p:organization><name>Cancer Therapy Evaluation Program</name></p:organization></p:studySite></p:assignment></assignments></p:participant>
<p:participant><firstName>Richard-4</firstName><lastName>Herd-4</lastName><maidenName></maidenName><middleName></middleName><birthDate>2001-01-01</birthDate><gender>Unknown</gender><race>Unknown</race><ethnicity>Unknown</ethnicity><identifiers><p:organizationAssignedIdentifier><type>MRN</type><value>barboza4</value><primaryIndicator>true</primaryIndicator><p:organization><name>Mayo Clinic Hospital</name></p:organization></p:organizationAssignedIdentifier><p:systemAssignedIdentifier><type>MRN</type><value>barboza4</value><primaryIndicator>true</primaryIndicator><systemName>Yarois</systemName></p:systemAssignedIdentifier></identifiers><assignments><p:assignment><p:studySite><p:study><identifiers><identifier><type>Protocol Authority Identifier</type><value>N027D</value></identifier></identifiers></p:study><p:organization><name>Cancer Therapy Evaluation Program</name></p:organization></p:studySite></p:assignment></assignments></p:participant>
</p:participants>
