<?xml version="1.0" encoding="UTF-8"?>
<p:participants xmlns:p="http://webservice.caaers.cabig.nci.nih.gov/participant" xmlns:xsi="http://www.w3.org/2001/XMLSchema-instance" xsi:schemaLocation="http://webservice.caaers.cabig.nci.nih.gov/participant ParticipantSchema.xsd ">
  <p:participant>
    <firstName>mayo</firstName>
    <lastName>pt1</lastName>
    <maidenName>xx</maidenName>
    <middleName>yy</middleName>
    <birthDate>2001-01-01</birthDate>
    <gender>Male</gender>
    <race>Asian</race>
    <ethnicity>Hispanic or Latino</ethnicity>
    <identifiers>
      <p:organizationAssignedIdentifier>
        <type>MRN</type>
        <value>mayo-pt1</value>
        <primaryIndicator>true</primaryIndicator>
        <p:organization>
          <name>Mayo Clinic Rochester</name>
          <nciInstituteCode>MN026</nciInstituteCode>
        </p:organization>
      </p:organizationAssignedIdentifier>
      <p:systemAssignedIdentifier>
        <type>MRN</type>
        <value>mayo-pt1</value>
        <primaryIndicator>true</primaryIndicator>
        <systemName>MY TEST SYTEM</systemName>
      </p:systemAssignedIdentifier>
    </identifiers>
    <assignments>
      <p:assignment>
        <studySubjectIdentifier>ssi-mayo-pt1</studySubjectIdentifier>
        <p:studySite>
          <p:study>
            <identifiers>
              <identifier>
                <type>Protocol Authority Identifier</type>
                <value>8052</value>
              </identifier>
            </identifiers>
          </p:study>
          <p:organization>
            <name>Cancer Therapy Evaluation Program</name>
            <nciInstituteCode>CTEP</nciInstituteCode>
          </p:organization>
        </p:studySite>
      </p:assignment>
    </assignments>
  </p:participant>
</p:participants>
